A2: 1
A3: 2
A4: 3
A5: 4
A6: 5
A7: 6

A1: A | B1: B
A2: 数据 1 | B2: 数据 2
A3: 6 | B3: 20
A4: 7 | B4: 28
A5: 9 | B5: 31
A6: 15 | B6: 38
A7: 21 | B7: 40
A8: 公式 | B8: 说明（结果）
A9: =FTEST(A2:A6,B2:B6) | B9: 返回上述数据的 F 检验结果 (0.648318)

A1: 运用FTEST函数进行双样本方差分析
B2: 收益率
A3: day | B3: 深发展 | C3: 万科A
A4: 20040601 | B4: 3.0999999999999999E-3 | C4: 9.9000000000000008E-3
A5: 20040602 | B5: 3.0099999999999998E-2 | C5: -1.37E-2
A6: 20040603 | B6: -2.3099999999999999E-2 | C6: -1.3899999999999999E-2
A7: 20040604 | B7: -8.2000000000000007E-3 | C7: 6.0000000000000001E-3
A8: 20040607 | B8: -2.2800000000000001E-2 | C8: -8.0000000000000002E-3
A9: 20040608 | B9: -2.23E-2 | C9: 2E-3
A10: 20040609 | B10: -1.09E-2 | C10: -2.0199999999999999E-2
A11: 20040610 | B11: -2.2000000000000001E-3 | C11: 4.1000000000000003E-3
A12: 20040611 | B12: 0 | C12: 2E-3
A13: 20040614 | B13: -2.0899999999999998E-2 | C13: -1.23E-2
A14: 20040615 | B14: 4.6100000000000002E-2 | C14: 1.8599999999999998E-2
A15: 20040616 | B15: -9.7000000000000003E-3 | C15: -2E-3
A16: 20040617 | B16: -2.2800000000000001E-2 | C16: -4.2799999999999998E-2
A17: 20040618 | B17: 1.11E-2 | C17: -2.5499999999999998E-2
A18: 20040621 | B18: -2.2000000000000001E-3 | C18: -2.2000000000000001E-3
A19: 20040622 | B19: 3.3E-3 | C19: 3.3E-3
A20: 20040623 | B20: -6.6E-3 | C20: -6.6E-3
A21: 20040624 | B21: -1.44E-2 | C21: -1.44E-2
A22: 20040625 | B22: -5.5999999999999999E-3 | C22: -5.5999999999999999E-3
A23: 20040628 | B23: -5.1900000000000002E-2 | C23: -5.1900000000000002E-2
A24: 20040629 | B24: 2.2599999999999999E-2 | C24: 2.2599999999999999E-2
A25: 方差 | B25: =STDEV(B4:B24)^2 -> 4.4552690476190474E-4 | C25: =STDEV(C4:C24)^2 -> 3.2087314285714278E-4
A26: 运用FTEST进行检验
A27: alpha | B27: 0.05
A28: 使用Ftest的P值 | B28: =FTEST(B4:B24,C4:C24) -> 0.46956021530198394
A29: F统计量 | B29: =B25/C25 -> 1.3884830023317332
A30: P值 | B30: =FDIST(B29,COUNT(B4:B24)-1,COUNT(C4:C24)-1) -> 0.23478010765099197